{
  "$schema": "http://json-schema.org/draft-07/schema#",
  "title": "SynthesisResult",
  "description": "Canonical contracted schema for Phase 08.4G deterministic result synthesis.",
  "type": "object",
  "properties": {
    "workflow_id": {
      "type": "string",
      "description": "Unique identifier of the executed workflow."
    },
    "workflow_version": {
      "type": "string",
      "description": "Version of the executed workflow definition."
    },
    "status": {
      "type": "string",
      "enum": ["SUCCESS", "FAILED", "PARTIAL"],
      "description": "Overall terminal status of the result synthesis."
    },
    "synthesis_eligible": {
      "type": "boolean",
      "description": "Flag indicating whether the workflow output met the 08.4F Join Gate eligibility criteria for synthesis."
    },
    "task_attributions": {
      "type": "array",
      "description": "Deterministic, declared-order collection of per-task outputs preserving attribution and worker terminal states.",
      "items": {
        "type": "object",
        "properties": {
          "task_id": {
            "type": "string",
            "description": "Identifier of the task."
          },
          "agent_id": {
            "type": "string",
            "description": "Identifier of the agent that executed or was assigned to the task."
          },
          "status": {
            "type": "string",
            "enum": ["SUCCESS", "FAILED", "TIMEOUT", "NOT_EXECUTED"],
            "description": "Terminal outcome of the worker/task execution."
          },
          "findings": {
            "type": "array",
            "description": "Raw structured data extracted or generated by the agent/task.",
            "items": {
              "type": "object",
              "additionalProperties": true
            }
          },
          "artifacts": {
            "type": "array",
            "description": "File paths or URIs created/modified by the task.",
            "items": {
              "type": "string"
            }
          },
          "errors": {
            "type": "array",
            "description": "Error messages recorded during task execution, if any.",
            "items": {
              "type": "string"
            }
          }
        },
        "required": ["task_id", "status", "findings"]
      }
    },
    "aggregated_findings": {
      "type": "array",
      "description": "Consolidated findings aggregated strictly in declared workflow order, preserving task attribution without deduplication or reordering.",
      "items": {
        "type": "object",
        "properties": {
          "task_id": {
            "type": "string",
            "description": "Identifier of the task from which this finding originated."
          },
          "data": {
            "type": "object",
            "description": "Structured finding payload.",
            "additionalProperties": true
          }
        },
        "required": ["task_id", "data"]
      }
    },
    "errors": {
      "type": "array",
      "description": "Structured list of errors encountered across the workflow and individual steps.",
      "items": {
        "type": "string"
      }
    },
    "provenance": {
      "type": "object",
      "description": "Execution, reconciliation, and synthesis provenance metadata passed intact for 08.4H verification.",
      "additionalProperties": true
    }
  },
  "required": [
    "workflow_id",
    "workflow_version",
    "status",
    "synthesis_eligible",
    "task_attributions",
    "aggregated_findings",
    "errors",
    "provenance"
  ],
  "additionalProperties": false
}
