{
  "workflow_id": "bi_parallel_analysis_workflow",
  "workflow_version": "1.0",
  "status": "SUCCESS",
  "synthesis_eligible": true,
  "task_attributions": [
    {
      "task_id": "tableau_task",
      "agent_id": "tableau_agent",
      "status": "SUCCESS",
      "findings": [
        {
          "source": "tableau",
          "input_path": "/home/balaguruj8/BIOrch/examples/artifacts/tableau/superstore_base.twb",
          "output_directory": "/tmp/biorch_runtime_demo/tableau",
          "summary": {
            "datasources_count": 3,
            "tables_count": 5,
            "columns_count": 33,
            "worksheets_count": 21
          }
        }
      ],
      "artifacts": [],
      "errors": []
    },
    {
      "task_id": "pbi_task",
      "agent_id": "powerbi_agent",
      "status": "SUCCESS",
      "findings": [
        {
          "source": "powerbi",
          "model_folder": "/home/balaguruj8/BIOrch/examples/artifacts/powerbi/AdventureWorks Sales/AdventureWorks Sales.SemanticModel",
          "database_name": null,
          "summary": {
            "tables_count": 10,
            "columns_count": 62,
            "relationships_count": 9
          }
        }
      ],
      "artifacts": [],
      "errors": []
    }
  ],
  "aggregated_findings": [
    {
      "task_id": "tableau_task",
      "data": {
        "source": "tableau",
        "input_path": "/home/balaguruj8/BIOrch/examples/artifacts/tableau/superstore_base.twb",
        "output_directory": "/tmp/biorch_runtime_demo/tableau",
        "summary": {
          "datasources_count": 3,
          "tables_count": 5,
          "columns_count": 33,
          "worksheets_count": 21
        }
      }
    },
    {
      "task_id": "pbi_task",
      "data": {
        "source": "powerbi",
        "model_folder": "/home/balaguruj8/BIOrch/examples/artifacts/powerbi/AdventureWorks Sales/AdventureWorks Sales.SemanticModel",
        "database_name": null,
        "summary": {
          "tables_count": 10,
          "columns_count": 62,
          "relationships_count": 9
        }
      }
    }
  ],
  "errors": [],
  "provenance": {
    "workflow_id": "bi_parallel_analysis_workflow",
    "workflow_version": "1.0",
    "validation_passed": true,
    "execution_order": [
      "pbi_task",
      "tableau_task"
    ],
    "completed_steps": [
      "pbi_task",
      "tableau_task"
    ],
    "failed_step": null,
    "terminal_status": "SUCCESS",
    "synthesis_contract": "BIORCH-SYNTH-001",
    "synthesis_version": "1.0",
    "synthesis_status": "SUCCESS",
    "synthesis_task_count": 2
  }
}