{
  "workflow_id": "bi_parallel_analysis_workflow",
  "workflow_version": "1.0",
  "status": "FAILED",
  "synthesis_eligible": false,
  "task_attributions": [
    {
      "task_id": "tableau_task",
      "agent_id": "tableau_agent",
      "status": "NOT_EXECUTED",
      "findings": [],
      "artifacts": [],
      "errors": []
    },
    {
      "task_id": "pbi_task",
      "agent_id": "powerbi_agent",
      "status": "FAILED",
      "findings": [],
      "artifacts": [],
      "errors": [
        "Failed to load TOM assembly from .deps/microsoft.analysisservices/19.117.0/lib/net6.0/Microsoft.AnalysisServices.Tabular.dll"
      ]
    }
  ],
  "aggregated_findings": [],
  "errors": [
    "Failed to load TOM assembly from .deps/microsoft.analysisservices/19.117.0/lib/net6.0/Microsoft.AnalysisServices.Tabular.dll"
  ],
  "provenance": {
    "workflow_id": "bi_parallel_analysis_workflow",
    "workflow_version": "1.0",
    "validation_passed": true,
    "execution_order": [
      "pbi_task"
    ],
    "completed_steps": [],
    "failed_step": "pbi_task",
    "terminal_status": "FAILED",
    "synthesis_contract": "BIORCH-SYNTH-001",
    "synthesis_version": "1.0",
    "synthesis_status": "FAILED",
    "synthesis_task_count": 2
  }
}